{
  "name": "toy-matmul",
  "artifacts": [],
  "knobs": [
    {
      "name": "mode",
      "type": "enum",
      "values": ["eager", "compiled"],
      "minimum": null,
      "maximum": null
    },
    {
      "name": "tile",
      "type": "integer",
      "values": [],
      "minimum": 16,
      "maximum": 32
    }
  ],
  "parameters": {
    "dtype": "float32",
    "shape": [1, 3072, 3072]
  }
}
